{
  "$schema": "http://json-schema.org/draft-07/schema#",
  "$id": "https://aerotwin.ai/schemas/FaultPrediction.schema.json",
  "title": "FaultPrediction",
  "description": "Fault classification and anomaly score with explanation. Producer: M4 (Fault AI). Consumers: M5, M6.",
  "type": "object",
  "required": ["engineId", "missionId", "correlationId", "predictionTime", "faultType", "confidence", "anomalyScore", "contributors", "producerVersion"],
  "additionalProperties": true,
  "properties": {
    "engineId": { "type": "string" },
    "missionId": { "type": "string" },
    "correlationId": { "type": "string" },
    "predictionTime": { "type": "string", "format": "date-time" },
    "producerVersion": { "type": "string", "description": "Model + feature-pipeline version, e.g. fault-clf-1.2.0." },
    "faultType": {
      "type": "string",
      "enum": ["NONE", "OVERHEATING", "OIL_PRESSURE_DEGRADATION", "VIBRATION_MISFIRE", "SENSOR_FAULT"],
      "description": "Predicted fault class."
    },
    "confidence": { "type": "number", "minimum": 0, "maximum": 1, "description": "Classifier confidence for faultType." },
    "anomalyScore": { "type": "number", "minimum": 0, "maximum": 1, "description": "Unsupervised anomaly score, 0 = normal, 1 = highly anomalous." },
    "contributors": {
      "type": "array",
      "description": "Top contributing features (SHAP or equivalent), ordered by impact.",
      "items": {
        "type": "object",
        "required": ["feature", "contribution"],
        "additionalProperties": false,
        "properties": {
          "feature": { "type": "string" },
          "contribution": { "type": "number", "description": "Signed contribution weight, positive pushes toward the predicted fault." }
        }
      }
    },
    "detectionDelayMs": {
      "type": "number",
      "minimum": 0,
      "description": "Optional. Time from fault injection/onset to this prediction, for latency evaluation on labeled scenarios."
    },
    "componentId": {
      "type": "string",
      "description": "Optional. Level-3 localization: most probable affected component/subsystem, e.g. 'oil-system'. Omitted when the classifier cannot reliably distinguish a component."
    },
    "subsystem": {
      "type": "string",
      "description": "Optional. Human-readable subsystem label paired with componentId, e.g. 'Lubrication'."
    },
    "severity": {
      "type": "string",
      "enum": ["info", "warning", "high", "critical"],
      "description": "Optional. Advisory severity derived from confidence + anomaly score. Absent when faultType is NONE."
    },
    "evidence": {
      "type": "array",
      "items": { "type": "string" },
      "description": "Optional. Human-readable evidence lines supporting the fault claim (e.g. 'Oil pressure below expected operating range')."
    },
    "recommendedAction": {
      "type": "string",
      "description": "Optional. Suggested next step for the operator/maintenance engineer."
    },
    "alternativePossibilities": {
      "type": "array",
      "items": { "type": "string" },
      "description": "Optional. Other plausible explanations the model did not rule out (e.g. 'Oil pressure sensor drift')."
    },
    "requiresHumanConfirmation": {
      "type": "boolean",
      "description": "Optional. True whenever faultType is not NONE — this demonstrator never claims an autonomous, confirmed diagnosis."
    },
    "operatingConditionOutOfRange": {
      "type": "boolean",
      "description": "Optional. True when M2's operating-envelope check (altitude/ambient temperature) found the source TwinState outside its calibrated range, so this prediction's confidence is reduced accordingly."
    }
  }
}
